{
  "schema_version": "1.0",
  "generated_at": "2026-06-26T00:00:00Z",
  "source": {
    "repository": "https://github.com/llaurila/veeling",
    "releases_url": "https://github.com/llaurila/veeling/releases"
  },
  "channels": {
    "stable": {
      "version": "0.4.1",
      "tag": "v0.4.1",
      "published_at": "2026-06-26T00:00:00Z",
      "release_url": "https://github.com/llaurila/veeling/releases/tag/v0.4.1",
      "notes_url": "https://github.com/llaurila/veeling/releases/tag/v0.4.1",
      "changelog_url": "https://github.com/llaurila/veeling/blob/main/CHANGELOG.md",
      "compatibility": {
        "minimum_cli_version": null,
        "notes": "No compatibility floor declared yet."
      }
    },
    "prerelease": null
  }
}
